### ISSUE TITLE
Server not emitting JSON replies with smoltcp 0.6.0 or unstable

### ISSUE THREAD

**Issue by HarryMakes** [quartiq/stabilizer#211]
In response to https://github.com/quartiq/stabilizer/issues/140#issuecomment-726685975, I resolved the server panicking issue (#140) by replacing smoltcp 0.6.0 with https://github.com/smoltcp-rs/smoltcp/commit/5cfbfbb02e0fe58f41cc8e27d1572d4c1f15fae1, using Stabilizer's 1bf71f335b9d50db579ea9c09b520a4b49cf7f0f.

However, a new issue has emerged from this modification. If connection to the Stabilizer server through the dedicated port is successful, the client can always send a JSON request to adjust the IIR filter via `stabilizer.py`, and the DAC output is correctly adjusted accordingly. But the server does not seem to provide any JSON replies for applying the filter settings. A example TCP dump and the bytes are attached below:

<details><summary>`tshark` Capture</summary>

```
# $ python3 -m stabilizer -s 192.168.1.76 -c 0 -p 1
    8 11.500929221 192.168.1.116 → 192.168.1.76 TCP 74 38380 → 1235 [SYN] Seq=0 Win=64240 Len=0 MSS=1460 SACK_PERM=1 TSval=761216449 TSecr=0 WS=128
    9 11.501104741 192.168.1.76 → 192.168.1.116 TCP 66 1235 → 38380 [SYN, ACK] Seq=0 Ack=1 Win=5792 Len=0 MSS=1460 WS=1 SACK_PERM=1
   10 11.501122846 192.168.1.116 → 192.168.1.76 TCP 54 38380 → 1235 [ACK] Seq=1 Ack=1 Win=64256 Len=0
   11 11.501370682 192.168.1.116 → 192.168.1.76 TCP 213 38380 → 1235 [PSH, ACK] Seq=1 Ack=1 Win=64256 Len=159
   12 11.708903126 192.168.1.116 → 192.168.1.76 TCP 213 [TCP Retransmission] 38380 → 1235 [PSH, ACK] Seq=1 Ack=1 Win=64256 Len=159
   13 11.916906099 192.168.1.116 → 192.168.1.76 TCP 213 [TCP Retransmission] 38380 → 1235 [PSH, ACK] Seq=1 Ack=1 Win=64256 Len=159
   14 12.324895567 192.168.1.116 → 192.168.1.76 TCP 213 [TCP Retransmission] 38380 → 1235 [PSH, ACK] Seq=1 Ack=1 Win=64256 Len=159
   15 13.042041665 192.168.1.116 → 192.168.1.76 TCP 54 38380 → 1235 [FIN, ACK] Seq=160 Ack=1 Win=64256 Len=0
   16 13.140904877 192.168.1.116 → 192.168.1.76 TCP 213 [TCP Retransmission] 38380 → 1235 [FIN, PSH, ACK] Seq=1 Ack=1 Win=64256 Len=159
   17 13.141108450 192.168.1.76 → 192.168.1.116 TCP 60 1235 → 38380 [ACK] Seq=1 Ack=161 Win=5840 Len=0
   18 13.141190531 192.168.1.76 → 192.168.1.116 TCP 60 1235 → 38380 [FIN, ACK] Seq=1 Ack=161 Win=5840 Len=0
   19 13.141200687 192.168.1.116 → 192.168.1.76 TCP 54 38380 → 1235 [ACK] Seq=161 Ack=2 Win=64256 Len=0

# $ python3 -m stabilizer -s 192.168.1.76 -c 0 -p 1
   20 17.832448325 192.168.1.116 → 192.168.1.76 TCP 74 38382 → 1235 [SYN] Seq=0 Win=64240 Len=0 MSS=1460 SACK_PERM=1 TSval=761222781 TSecr=0 WS=128
   21 17.832631811 192.168.1.76 → 192.168.1.116 TCP 66 1235 → 38382 [SYN, ACK] Seq=0 Ack=1 Win=5792 Len=0 MSS=1460 WS=1 SACK_PERM=1
   22 17.832649759 192.168.1.116 → 192.168.1.76 TCP 54 38382 → 1235 [ACK] Seq=1 Ack=1 Win=64256 Len=0
   23 17.832982192 192.168.1.116 → 192.168.1.76 TCP 213 38382 → 1235 [PSH, ACK] Seq=1 Ack=1 Win=64256 Len=159
   24 18.036906878 192.168.1.116 → 192.168.1.76 TCP 213 [TCP Retransmission] 38382 → 1235 [PSH, ACK] Seq=1 Ack=1 Win=64256 Len=159
   25 18.244901492 192.168.1.116 → 192.168.1.76 TCP 213 [TCP Retransmission] 38382 → 1235 [PSH, ACK] Seq=1 Ack=1 Win=64256 Len=159
   26 18.652903766 192.168.1.116 → 192.168.1.76 TCP 213 [TCP Retransmission] 38382 → 1235 [PSH, ACK] Seq=1 Ack=1 Win=64256 Len=159
   27 19.258533563 192.168.1.116 → 192.168.1.76 TCP 54 38382 → 1235 [FIN, ACK] Seq=160 Ack=1 Win=64256 Len=0
   28 19.476895277 192.168.1.116 → 192.168.1.76 TCP 213 [TCP Retransmission] 38382 → 1235 [FIN, PSH, ACK] Seq=1 Ack=1 Win=64256 Len=159
   29 19.477102266 192.168.1.76 → 192.168.1.116 TCP 60 1235 → 38382 [ACK] Seq=1 Ack=161 Win=5840 Len=0
   30 19.477184791 192.168.1.76 → 192.168.1.116 TCP 60 1235 → 38382 [FIN, ACK] Seq=1 Ack=161 Win=5840 Len=0
   31 19.477194713 192.168.1.116 → 192.168.1.76 TCP 54 38382 → 1235 [ACK] Seq=161 Ack=2 Win=64256 Len=0

# $ python3 -m stabilizer -s 192.168.1.76 -c 0 -p 3
   32 23.325824061 192.168.1.116 → 192.168.1.76 TCP 74 38384 → 1235 [SYN] Seq=0 Win=64240 Len=0 MSS=1460 SACK_PERM=1 TSval=761228274 TSecr=0 WS=128
   33 23.326002037 192.168.1.76 → 192.168.1.116 TCP 66 1235 → 38384 [SYN, ACK] Seq=0 Ack=1 Win=5792 Len=0 MSS=1460 WS=1 SACK_PERM=1
   34 23.326019094 192.168.1.116 → 192.168.1.76 TCP 54 38384 → 1235 [ACK] Seq=1 Ack=1 Win=64256 Len=0
   35 23.326275320 192.168.1.116 → 192.168.1.76 TCP 213 38384 → 1235 [PSH, ACK] Seq=1 Ack=1 Win=64256 Len=159
   36 23.532902360 192.168.1.116 → 192.168.1.76 TCP 213 [TCP Retransmission] 38384 → 1235 [PSH, ACK] Seq=1 Ack=1 Win=64256 Len=159
   37 23.740911620 192.168.1.116 → 192.168.1.76 TCP 213 [TCP Retransmission] 38384 → 1235 [PSH, ACK] Seq=1 Ack=1 Win=64256 Len=159
   38 24.148894795 192.168.1.116 → 192.168.1.76 TCP 213 [TCP Retransmission] 38384 → 1235 [PSH, ACK] Seq=1 Ack=1 Win=64256 Len=159
   39 24.980900587 192.168.1.116 → 192.168.1.76 TCP 213 [TCP Retransmission] 38384 → 1235 [PSH, ACK] Seq=1 Ack=1 Win=64256 Len=159
   40 24.994333796 192.168.1.116 → 192.168.1.76 TCP 54 38384 → 1235 [FIN, ACK] Seq=160 Ack=1 Win=64256 Len=0
   41 26.644902056 192.168.1.116 → 192.168.1.76 TCP 213 [TCP Retransmission] 38384 → 1235 [FIN, PSH, ACK] Seq=1 Ack=1 Win=64256 Len=159
   42 26.645111029 192.168.1.76 → 192.168.1.116 TCP 60 1235 → 38384 [ACK] Seq=1 Ack=161 Win=5840 Len=0
   43 26.645192672 192.168.1.76 → 192.168.1.116 TCP 60 1235 → 38384 [FIN, ACK] Seq=1 Ack=161 Win=5840 Len=0
   44 26.645202844 192.168.1.116 → 192.168.1.76 TCP 54 38384 → 1235 [ACK] Seq=161 Ack=2 Win=64256 Len=0

# $ python3 -m stabilizer -s 192.168.1.76 -c 0 -p -1
   45 30.725403606 192.168.1.116 → 192.168.1.76 TCP 74 38386 → 1235 [SYN] Seq=0 Win=64240 Len=0 MSS=1460 SACK_PERM=1 TSval=761235674 TSecr=0 WS=128
   46 30.725587553 192.168.1.76 → 192.168.1.116 TCP 66 1235 → 38386 [SYN, ACK] Seq=0 Ack=1 Win=5792 Len=0 MSS=1460 WS=1 SACK_PERM=1
   47 30.725605036 192.168.1.116 → 192.168.1.76 TCP 54 38386 → 1235 [ACK] Seq=1 Ack=1 Win=64256 Len=0
   48 30.725881827 192.168.1.116 → 192.168.1.76 TCP 215 38386 → 1235 [PSH, ACK] Seq=1 Ack=1 Win=64256 Len=161
   49 30.932915240 192.168.1.116 → 192.168.1.76 TCP 215 [TCP Retransmission] 38386 → 1235 [PSH, ACK] Seq=1 Ack=1 Win=64256 Len=161
   50 31.140908712 192.168.1.116 → 192.168.1.76 TCP 215 [TCP Retransmission] 38386 → 1235 [PSH, ACK] Seq=1 Ack=1 Win=64256 Len=161
   51 31.548903133 192.168.1.116 → 192.168.1.76 TCP 215 [TCP Retransmission] 38386 → 1235 [PSH, ACK] Seq=1 Ack=1 Win=64256 Len=161
   52 32.404900878 192.168.1.116 → 192.168.1.76 TCP 215 [TCP Retransmission] 38386 → 1235 [PSH, ACK] Seq=1 Ack=1 Win=64256 Len=161
   53 32.962460614 192.168.1.116 → 192.168.1.76 TCP 54 38386 → 1235 [FIN, ACK] Seq=162 Ack=1 Win=64256 Len=0
   54 34.068895536 192.168.1.116 → 192.168.1.76 TCP 215 [TCP Retransmission] 38386 → 1235 [FIN, PSH, ACK] Seq=1 Ack=1 Win=64256 Len=161
   55 34.069105787 192.168.1.76 → 192.168.1.116 TCP 60 1235 → 38386 [ACK] Seq=1 Ack=163 Win=5840 Len=0
   56 34.069187413 192.168.1.76 → 192.168.1.116 TCP 60 1235 → 38386 [FIN, ACK] Seq=1 Ack=163 Win=5840 Len=0
   57 34.069197658 192.168.1.116 → 192.168.1.76 TCP 54 38386 → 1235 [ACK] Seq=163 Ack=2 Win=64256 Len=0

# $ python3 -m stabilizer -s 192.168.1.76 -c 0 -p 2
   58 37.447713194 192.168.1.116 → 192.168.1.76 TCP 74 38388 → 1235 [SYN] Seq=0 Win=64240 Len=0 MSS=1460 SACK_PERM=1 TSval=761242396 TSecr=0 WS=128
   59 37.447892569 192.168.1.76 → 192.168.1.116 TCP 66 1235 → 38388 [SYN, ACK] Seq=0 Ack=1 Win=5792 Len=0 MSS=1460 WS=1 SACK_PERM=1
   60 37.447909590 192.168.1.116 → 192.168.1.76 TCP 54 38388 → 1235 [ACK] Seq=1 Ack=1 Win=64256 Len=0
   61 37.448188890 192.168.1.116 → 192.168.1.76 TCP 213 38388 → 1235 [PSH, ACK] Seq=1 Ack=1 Win=64256 Len=159
   62 37.652911491 192.168.1.116 → 192.168.1.76 TCP 213 [TCP Retransmission] 38388 → 1235 [PSH, ACK] Seq=1 Ack=1 Win=64256 Len=159
   63 37.860893529 192.168.1.116 → 192.168.1.76 TCP 213 [TCP Retransmission] 38388 → 1235 [PSH, ACK] Seq=1 Ack=1 Win=64256 Len=159
   64 38.268878140 192.168.1.116 → 192.168.1.76 TCP 213 [TCP Retransmission] 38388 → 1235 [PSH, ACK] Seq=1 Ack=1 Win=64256 Len=159
   65 39.124895126 192.168.1.116 → 192.168.1.76 TCP 213 [TCP Retransmission] 38388 → 1235 [PSH, ACK] Seq=1 Ack=1 Win=64256 Len=159
   66 39.850793717 192.168.1.116 → 192.168.1.76 TCP 54 38388 → 1235 [FIN, ACK] Seq=160 Ack=1 Win=64256 Len=0
   67 40.788929963 192.168.1.116 → 192.168.1.76 TCP 213 [TCP Retransmission] 38388 → 1235 [FIN, PSH, ACK] Seq=1 Ack=1 Win=64256 Len=159
   68 40.789146673 192.168.1.76 → 192.168.1.116 TCP 60 1235 → 38388 [ACK] Seq=1 Ack=161 Win=5840 Len=0
   69 40.789146689 192.168.1.76 → 192.168.1.116 TCP 60 1235 → 38388 [FIN, ACK] Seq=1 Ack=161 Win=5840 Len=0
```
</details>
<details><summary>`tshark` Captured Bytes (only packets TX'ed by client contain bytes)</summary>

```
# $ python3 -m stabilizer -s 192.168.1.76 -c 0 -p 1
7b22726571223a225772697465222c22617474726962757465223a2273746162696c697a65722f696972302f7374617465222c2276616c7565223a227b276368616e6e656c273a302c27696972273a7b276261273a5b312e302c302e302c302e302c302e302c302e305d2c27795f6f6666736574273a302e302c27795f6d696e273a2d33323736382e302c27795f6d6178273a33323736372e307d7d227d0a

# $ python3 -m stabilizer -s 192.168.1.76 -c 0 -p 1
7b22726571223a225772697465222c22617474726962757465223a2273746162696c697a65722f696972302f7374617465222c2276616c7565223a227b276368616e6e656c273a302c27696972273a7b276261273a5b312e302c302e302c302e302c302e302c302e305d2c27795f6f6666736574273a302e302c27795f6d696e273a2d33323736382e302c27795f6d6178273a33323736372e307d7d227d0a

# $ python3 -m stabilizer -s 192.168.1.76 -c 0 -p 3
7b22726571223a225772697465222c22617474726962757465223a2273746162696c697a65722f696972302f7374617465222c2276616c7565223a227b276368616e6e656c273a302c27696972273a7b276261273a5b332e302c302e302c302e302c302e302c302e305d2c27795f6f6666736574273a302e302c27795f6d696e273a2d33323736382e302c27795f6d6178273a33323736372e307d7d227d0a

# $ python3 -m stabilizer -s 192.168.1.76 -c 0 -p -1
7b22726571223a225772697465222c22617474726962757465223a2273746162696c697a65722f696972302f7374617465222c2276616c7565223a227b276368616e6e656c273a302c27696972273a7b276261273a5b2d312e302c302e302c302e302c302e302c302e305d2c27795f6f6666736574273a2d302e302c27795f6d696e273a2d33323736382e302c27795f6d6178273a33323736372e307d7d227d0a

# $ python3 -m stabilizer -s 192.168.1.76 -c 0 -p 2
7b22726571223a225772697465222c22617474726962757465223a2273746162696c697a65722f696972302f7374617465222c2276616c7565223a227b276368616e6e656c273a302c27696972273a7b276261273a5b322e302c302e302c302e302c302e302c302e305d2c27795f6f6666736574273a302e302c27795f6d696e273a2d33323736382e302c27795f6d6178273a33323736372e307d7d227d0a
```
</details>

**Comment by HarryMakes** [comment]
Just reproduced this bug with smoltcp 0.6.0.

**Comment by HarryMakes** [comment]
Using 659a6879f7b78495bb4b3dbd3f7047298ea7c1d0, server can now emit JSON replies (e.g. via `stabilizer.py`) immediately after receiving requests. However, a new erroneous behaviour has appeared where the port can only be connected once (see #239)
