### ISSUE TITLE
Socket becomes unconnectable after indefinite period of time with smoltcp 0.6.0 or unstable

### ISSUE THREAD

**Issue by HarryMakes** [quartiq/stabilizer#212]
In response to https://github.com/quartiq/stabilizer/issues/140#issuecomment-726685975, I resolved the server panicking issue (#140) by replacing smoltcp 0.6.0 with https://github.com/smoltcp-rs/smoltcp/commit/5cfbfbb02e0fe58f41cc8e27d1572d4c1f15fae1, using Stabilizer's 1bf71f335b9d50db579ea9c09b520a4b49cf7f0f.

However, a new issue has emerged from this modification. As long as the client has not connected to the Stabilizer's port (1235 by default) once, it can always successfully connect to the port or ping the server with no issues. However, after the client has successfully connected to the port at least once, after an indefinite period of time, the port can no longer be connected; in the case of using `stabilizer.py`, the error `ConnectionRefusedError` comes up. Meanwhile, the server can always still be pinged with no issues, which indicates that the board has not panicked (like #140). A example TCP dump is attached below to show the port connection issue:

<details><summary>`tshark` Capture (some unrelated packets are not shown)</summary>

```
# $ ping 192.168.1.76
# Pinging is OK
    1 0.000000000 192.168.1.116 → 192.168.1.76 ICMP 98 Echo (ping) request  id=0x0089, seq=1/256, ttl=64
    2 1.039949415 192.168.1.116 → 192.168.1.76 ICMP 98 Echo (ping) request  id=0x0089, seq=2/512, ttl=64
    3 2.063948263 192.168.1.116 → 192.168.1.76 ICMP 98 Echo (ping) request  id=0x0089, seq=3/768, ttl=64

# Connecting to the port with `nc` without sending any bytes:
# $ nc 192.168.1.76 1235
# Connection is OK
    5 5.877880987 192.168.1.116 → 192.168.1.76 TCP 74 38492 → 1235 [SYN] Seq=0 Win=64240 Len=0 MSS=1460 SACK_PERM=1 TSval=762587343 TSecr=0 WS=128
    7 6.927943561 192.168.1.116 → 192.168.1.76 TCP 74 [TCP Retransmission] 38492 → 1235 [SYN] Seq=0 Win=64240 Len=0 MSS=1460 SACK_PERM=1 TSval=762588393 TSecr=0 WS=128
# Ctrl+C

# `nc` to the port again:
# $ nc 192.168.1.76 1235
# Connection is OK
   11 8.669975898 192.168.1.116 → 192.168.1.76 TCP 74 38494 → 1235 [SYN] Seq=0 Win=64240 Len=0 MSS=1460 SACK_PERM=1 TSval=762590135 TSecr=0 WS=128
   12 8.670163303 192.168.1.76 → 192.168.1.116 TCP 66 1235 → 38494 [SYN, ACK] Seq=0 Ack=1 Win=5792 Len=0 MSS=1460 WS=1 SACK_PERM=1
   13 8.670179217 192.168.1.116 → 192.168.1.76 TCP 54 38494 → 1235 [ACK] Seq=1 Ack=1 Win=64256 Len=0
# Ctrl+C
   14 9.419771259 192.168.1.116 → 192.168.1.76 TCP 54 38494 → 1235 [FIN, ACK] Seq=1 Ack=1 Win=64256 Len=0
   15 9.419972232 192.168.1.76 → 192.168.1.116 TCP 60 1235 → 38494 [ACK] Seq=1 Ack=2 Win=5840 Len=0
   16 9.419972245 192.168.1.76 → 192.168.1.116 TCP 60 1235 → 38494 [FIN, ACK] Seq=1 Ack=2 Win=5840 Len=0

# Attempting to run stabilizer.py again, but connection gets refused:
# $ python3 -m stabilizer -s 192.168.1.76 -c 0 -p 2
   17 13.138737948 192.168.1.116 → 192.168.1.76 TCP 74 38496 → 1235 [SYN] Seq=0 Win=64240 Len=0 MSS=1460 SACK_PERM=1 TSval=762594604 TSecr=0 WS=128
   18 13.138867309 192.168.1.76 → 192.168.1.116 TCP 60 1235 → 38496 [RST, ACK] Seq=1 Ack=1 Win=0 Len=0

# Attempting to `nc` to the port, but also fails:
# $ nc 192.168.1.76 1235
   19 18.631105239 192.168.1.116 → 192.168.1.76 TCP 74 38498 → 1235 [SYN] Seq=0 Win=64240 Len=0 MSS=1460 SACK_PERM=1 TSval=762600096 TSecr=0 WS=128
   20 18.631261104 192.168.1.76 → 192.168.1.116 TCP 60 1235 → 38498 [RST, ACK] Seq=1 Ack=1 Win=0 Len=0

# $ ping 192.168.1.76
# Pinging is OK
   21 20.742990583 192.168.1.116 → 192.168.1.76 ICMP 98 Echo (ping) request  id=0x008a, seq=1/256, ttl=64
   22 20.743159018 192.168.1.76 → 192.168.1.116 ICMP 98 Echo (ping) reply    id=0x008a, seq=1/256, ttl=64 (request in 21)
   23 21.775944904 192.168.1.116 → 192.168.1.76 ICMP 98 Echo (ping) request  id=0x008a, seq=2/512, ttl=64
   24 21.776105745 192.168.1.76 → 192.168.1.116 ICMP 98 Echo (ping) reply    id=0x008a, seq=2/512, ttl=64 (request in 23)
   25 22.799957738 192.168.1.116 → 192.168.1.76 ICMP 98 Echo (ping) request  id=0x008a, seq=3/768, ttl=64
   26 22.800116573 192.168.1.76 → 192.168.1.116 ICMP 98 Echo (ping) reply    id=0x008a, seq=3/768, ttl=64 (request in 25)
   27 23.823968146 192.168.1.116 → 192.168.1.76 ICMP 98 Echo (ping) request  id=0x008a, seq=4/1024, ttl=64
   28 23.824129332 192.168.1.76 → 192.168.1.116 ICMP 98 Echo (ping) reply    id=0x008a, seq=4/1024, ttl=64 (request in 27)
```
</details>

**Comment by HarryMakes** [comment]
Just reproduced this bug with smoltcp 0.6.0.

**Comment by HarryMakes** [comment]
Using 659a6879f7b78495bb4b3dbd3f7047298ea7c1d0, server doesn't become unconnectable randomly. Instead, it becomes unconnectable once after it gets disconnected the first time upon power-cycling. (see #239)
