### ISSUE TITLE
Server won't acknowledge until a while after the client disconnects

### ISSUE THREAD

**Issue by HarryMakes** [quartiq/stabilizer#145]
Whenever a client connects to the port and send some valid messages to the board, the server doesn't seem to ACK before the client disconnects. It also would take a few seconds between the moment of client disconnection and server acknowledgement.

I suspect this has to do with the WFI behaviour on [these lines](https://github.com/quartiq/stabilizer/blob/d6de4b702857909efd6917307d8d21933eb3a8a2/src/main.rs#L890-L904). When I remove the WFI function entirely and replace those lines with the following code, the server will acknowledge immediately. Together with [my temporary "fix"](https://github.com/quartiq/stabilizer/issues/140) for Ethernet breakage by removing `json_reply()`, after I send a valid IIR request the DAC will be reprogrammed immediately.

```rust
/* comment out these lines
let sleep = match c.resources.net_interface.poll(
    &mut sockets,
    net::time::Instant::from_millis(time as i64),
) {
    Ok(changed) => changed == false,
    Err(net::Error::Unrecognized) => true,
    Err(e) => {
        info!("iface poll error: {:?}", e);
        true
    }
};

if sleep {
    cortex_m::asm::wfi();
}*/
match c.resources.net_interface.poll(
    &mut sockets,
    net::time::Instant::from_millis(time as i64),
) {
    Ok(_) => { },
    Err(_) => { }
};
```

**Comment by HarryMakes** [comment]
Here's my tshark dump for reference:
```
Capturing on 'eno1'
### Client sends packet
    1 0.000000000 192.168.1.116 → 192.168.1.79 TCP 74 59100 → 1235 [SYN] Seq=0 Win=64240 Len=0 MSS=1460 SACK_PERM=1 TSval=866585609 TSecr=0 WS=128
    2 0.000224907 192.168.1.79 → 192.168.1.116 TCP 66 1235 → 59100 [SYN, ACK] Seq=0 Ack=1 Win=5792 Len=0 MSS=1460 WS=1 SACK_PERM=1
    3 0.000244417 192.168.1.116 → 192.168.1.79 TCP 54 59100 → 1235 [ACK] Seq=1 Ack=1 Win=64256 Len=0
    4 0.000546200 192.168.1.116 → 192.168.1.79 TCP 215 59100 → 1235 [PSH, ACK] Seq=1 Ack=1 Win=64256 Len=161
### No response from server, client retransmits
    5 0.206658932 192.168.1.116 → 192.168.1.79 TCP 215 [TCP Retransmission] 59100 → 1235 [PSH, ACK] Seq=1 Ack=1 Win=64256 Len=161
    6 0.414664814 192.168.1.116 → 192.168.1.79 TCP 215 [TCP Retransmission] 59100 → 1235 [PSH, ACK] Seq=1 Ack=1 Win=64256 Len=161
    7 0.822620674 192.168.1.116 → 192.168.1.79 TCP 215 [TCP Retransmission] 59100 → 1235 [PSH, ACK] Seq=1 Ack=1 Win=64256 Len=161
    8 1.686660750 192.168.1.116 → 192.168.1.79 TCP 215 [TCP Retransmission] 59100 → 1235 [PSH, ACK] Seq=1 Ack=1 Win=64256 Len=161
    9 3.350673829 192.168.1.116 → 192.168.1.79 TCP 215 [TCP Retransmission] 59100 → 1235 [PSH, ACK] Seq=1 Ack=1 Win=64256 Len=161
### Client disconnects
   10 4.953085017 192.168.1.116 → 192.168.1.79 TCP 54 59100 → 1235 [FIN, ACK] Seq=162 Ack=1 Win=64256 Len=0
...
   13 6.614664725 192.168.1.116 → 192.168.1.79 TCP 215 [TCP Retransmission] 59100 → 1235 [FIN, PSH, ACK] Seq=1 Ack=1 Win=64256 Len=161
### Server finally replies
   14 6.614943576 192.168.1.79 → 192.168.1.116 TCP 60 1235 → 59100 [ACK] Seq=1 Ack=163 Win=5840 Len=0
   15 6.614997232 192.168.1.79 → 192.168.1.116 TCP 60 1235 → 59100 [FIN, ACK] Seq=1 Ack=163 Win=5840 Len=0
   16 6.615021534 192.168.1.116 → 192.168.1.79 TCP 54 59100 → 1235 [ACK] Seq=163 Ack=2 Win=64256 Len=0
```

**Comment by HarryMakes** [comment]
Update: after testing again, this issue is because I didn't tell the client to close the connection. The sleeping mechanism on the server is working fine.
